{
  "schema": "ualf-aat-export-manifest/v1",
  "profile": "draft-sharif-agent-audit-trail-00",
  "claim": "aat-validated/draft-sharif-agent-audit-trail-00",
  "transformed_at": "2026-08-02T18:00:10.470Z",
  "source": {
    "path": "example-trajectory.jsonl",
    "sha256": "13d9fd97f094cdbe7ac12761ddc881144f2f95106ae0de99fee9e58b886cc1c0",
    "bytes": 15743
  },
  "source_context": {
    "path": "example-aat-source.json",
    "sha256": "0e46b861ed08a18b88536a57469794921203e2e20e2bfd72f910f5f7fd470903",
    "bytes": 587
  },
  "export": {
    "path": "example-aat.jsonl",
    "sha256": "665f982676484e2d7dcf9e82a6c40df21f190fe6f22c51d939dbf3dfa1fa0d41",
    "bytes": 1158,
    "record_count": 2,
    "session_ids": [
      "44caeacd-3416-4e4f-a226-f47ff21f605d"
    ]
  },
  "exporter": {
    "name": "ualf-example-projection-builder",
    "version": "0.1.0"
  },
  "validator": {
    "name": "ualf-aat-validator",
    "version": "0.1.0"
  },
  "hashing": {
    "algorithm": "sha256-lowercase-hex",
    "json": "rfc8785-jcs",
    "text": "utf8-exact-no-normalization",
    "binary": "decoded-octets",
    "content_encoding": "decode-identity-or-gzip-before-hashing"
  },
  "identity": {
    "agent_id": "urn:agent:iplanic.ai:ualf-example-agent",
    "agent_version": "3.1.0",
    "trust_level": "L0",
    "trust_authority": "ualf-example-owner",
    "trust_basis": "no_verification"
  },
  "record_mappings": [
    {
      "record_id": "9bb1a83c-b5ac-4c94-b143-4b53e9db4cc7",
      "session_id": "44caeacd-3416-4e4f-a226-f47ff21f605d",
      "source_records": [
        "seq:1"
      ]
    },
    {
      "record_id": "eeb190b7-72ce-46a5-9d89-af97c131dc39",
      "session_id": "44caeacd-3416-4e4f-a226-f47ff21f605d",
      "source_records": [
        "seq:18"
      ]
    }
  ],
  "omissions": [
    {
      "source_record": "evt-run-observation",
      "reason": "No lossless AAT draft-00 action record in the minimal lifecycle projection."
    },
    {
      "source_record": "evt-test-start-1",
      "reason": "No lossless AAT draft-00 action record in the minimal lifecycle projection."
    },
    {
      "source_record": "evt-test-end-1",
      "reason": "No lossless AAT draft-00 action record in the minimal lifecycle projection."
    },
    {
      "source_record": "evt-test-error",
      "reason": "No lossless AAT draft-00 action record in the minimal lifecycle projection."
    },
    {
      "source_record": "evt-model-start",
      "reason": "No lossless AAT draft-00 action record in the minimal lifecycle projection."
    },
    {
      "source_record": "evt-model-end",
      "reason": "No lossless AAT draft-00 action record in the minimal lifecycle projection."
    },
    {
      "source_record": "evt-decision",
      "reason": "No lossless AAT draft-00 action record in the minimal lifecycle projection."
    },
    {
      "source_record": "evt-read-start",
      "reason": "No lossless AAT draft-00 action record in the minimal lifecycle projection."
    },
    {
      "source_record": "evt-read-end",
      "reason": "No lossless AAT draft-00 action record in the minimal lifecycle projection."
    },
    {
      "source_record": "evt-edit-start",
      "reason": "No lossless AAT draft-00 action record in the minimal lifecycle projection."
    },
    {
      "source_record": "evt-edit-end",
      "reason": "No lossless AAT draft-00 action record in the minimal lifecycle projection."
    },
    {
      "source_record": "evt-file-change",
      "reason": "No lossless AAT draft-00 action record in the minimal lifecycle projection."
    },
    {
      "source_record": "evt-retry",
      "reason": "No lossless AAT draft-00 action record in the minimal lifecycle projection."
    },
    {
      "source_record": "evt-test-start-2",
      "reason": "No lossless AAT draft-00 action record in the minimal lifecycle projection."
    },
    {
      "source_record": "evt-test-end-2",
      "reason": "No lossless AAT draft-00 action record in the minimal lifecycle projection."
    },
    {
      "source_record": "evt-evaluation",
      "reason": "No lossless AAT draft-00 action record in the minimal lifecycle projection."
    }
  ],
  "integrity": {
    "ualf_chain_sha256": "a14802c34481e3955260ab74bafd59979a1f4ee0a6b3b85ba787f9291a4ba295",
    "aat_session_hashes": {
      "44caeacd-3416-4e4f-a226-f47ff21f605d": "e9626aa7ab5ac10a215c64a8169b353a01b1d4d5fd15c97e3d4b7af4eb2fe6db"
    }
  },
  "seal": {
    "manifest_sha256": "8cae58dbec9e068d424f4bf4dec63e95bc63ab043a7bb9f5690d142da3291c35",
    "key_id": "ualf-aat-example-604147dd15884720",
    "algorithm": "ed25519",
    "public_key": "J6ZwAen_rhRzc3o-X1Yz_YTFr-Gxs4_bBGQr2DIf8EA",
    "signature": "2MVdnqZMZBIaycsso7Tmdp2gzs1R9lozMzT5kic1ylftOtwvJnvwdCkAsgi8R1RsiRpBaMrhCxPM77uNSNL-BQ"
  }
}
